04:01:14.222169 IP _gateway.51413 > ubuntu.ssh: Flags [P.], seq 1751285800:1751285860, ack 1193303025, win 2048, options [nop,nop,TS val 317487725 ecr 764602473], length 60
04:01:14.222217 IP ubuntu.ssh > _gateway.51413: Flags [.], ack 60, win 3551, options [nop,nop,TS val 764603450 ecr 317487725], length 0
04:01:14.225658 IP ubuntu.ssh > _gateway.51413: Flags [P.], seq 1:69, ack 60, win 3551, options [nop,nop,TS val 764603454 ecr 317487725], length 68
04:01:14.226106 IP _gateway.51413 > ubuntu.ssh: Flags [.], ack 69, win 2046, options [nop,nop,TS val 317487729 ecr 764603454], length 0
04:01:14.229752 IP _gateway.51413 > ubuntu.ssh: Flags [P.], seq 60:120, ack 69, win 2048, options [nop,nop,TS val 317487732 ecr 764603454], length 60
04:01:14.229822 IP ubuntu.ssh > _gateway.51413: Flags [.], ack 120, win 3551, options [nop,nop,TS val 764603458 ecr 317487732], length 0
04:01:14.229993 IP _gateway.51413 > ubuntu.ssh: Flags [P.], seq 120:196, ack 69, win 2048, options [nop,nop,TS val 317487732 ecr 764603454], length 76
04:01:14.230018 IP ubuntu.ssh > _gateway.51413: Flags [.], ack 196, win 3551, options [nop,nop,TS val 764603458 ecr 317487732], length 0
04:01:14.233738 IP ubuntu.ssh > _gateway.51413: Flags [P.], seq 69:137, ack 196, win 3551, options [nop,nop,TS val 764603462 ecr 317487732], length 68
04:01:14.234145 IP _gateway.51413 > ubuntu.ssh: Flags [.], ack 137, win 2046, options [nop,nop,TS val 317487736 ecr 764603462], length 0
04:01:14.236179 IP _gateway.51413 > ubuntu.ssh: Flags [P.], seq 196:264, ack 137, win 2048, options [nop,nop,TS val 317487737 ecr 764603462], length 68
04:01:14.236290 IP ubuntu.ssh > _gateway.51413: Flags [.], ack 264, win 3551, options [nop,nop,TS val 764603464 ecr 317487737], length 0
04:01:14.239142 IP ubuntu.ssh > _gateway.51413: Flags [P.], seq 137:197, ack 264, win 3551, options [nop,nop,TS val 764603467 ecr 317487737], length 60
04:01:14.239378 IP _gateway.51413 > ubuntu.ssh: Flags [.], ack 197, win 2047, options [nop,nop,TS val 317487740 ecr 764603467], length 0
04:01:14.241962 IP _gateway.51413 > ubuntu.ssh: Flags [P.], seq 264:332, ack 197, win 2048, options [nop,nop,TS val 317487742 ecr 764603467], length 68
04:01:14.244152 IP ubuntu.ssh > _gateway.51413: Flags [P.], seq 197:257, ack 332, win 3551, options [nop,nop,TS val 764603472 ecr 317487742], length 60
04:01:14.244443 IP _gateway.51413 > ubuntu.ssh: Flags [.], ack 257, win 2047, options [nop,nop,TS val 317487744 ecr 764603472], length 0
04:01:14.246079 IP _gateway.51413 > ubuntu.ssh: Flags [P.], seq 332:400, ack 257, win 2048, options [nop,nop,TS val 317487745 ecr 764603472], length 68
04:01:14.248003 IP ubuntu.ssh > _gateway.51413: Flags [P.], seq 257:317, ack 400, win 3551, options [nop,nop,TS val 764603476 ecr 317487745], length 60
04:01:14.248230 IP _gateway.51413 > ubuntu.ssh: Flags [.], ack 317, win 2047, options [nop,nop,TS val 317487747 ecr 764603476], length 0
04:01:14.268659 IP ubuntu.ssh > _gateway.51413: Flags [P.], seq 317:7557, ack 400, win 3551, options [nop,nop,TS val 764603497 ecr 317487747], length 7240
04:01:14.269582 IP _gateway.51413 > ubuntu.ssh: Flags [.], ack 1765, win 2025, options [nop,nop,TS val 317487767 ecr 764603497], length 0
04:01:14.269595 IP _gateway.51413 > ubuntu.ssh: Flags [.], ack 3213, win 2002, options [nop,nop,TS val 317487767 ecr 764603497], length 0
04:01:14.269602 IP _gateway.51413 > ubuntu.ssh: Flags [.], ack 4661, win 1980, options [nop,nop,TS val 317487767 ecr 764603497], length 0
04:01:14.269609 IP _gateway.51413 > ubuntu.ssh: Flags [.], ack 6109, win 1957, options [nop,nop,TS val 317487767 ecr 764603497], length 0
04:01:14.269616 IP _gateway.51413 > ubuntu.ssh: Flags [.], ack 6109, win 2048, options [nop,nop,TS val 317487767 ecr 764603497], length 0
04:01:14.269622 IP _gateway.51413 > ubuntu.ssh: Flags [.], ack 7557, win 2025, options [nop,nop,TS val 317487767 ecr 764603497], length 0
04:01:14.269653 IP ubuntu.ssh > _gateway.51413: Flags [P.], seq 7557:8673, ack 400, win 3551, options [nop,nop,TS val 764603497 ecr 317487747], length 1116
04:01:14.270005 IP ubuntu.ssh > _gateway.51413: Flags [P.], seq 8673:8757, ack 400, win 3551, options [nop,nop,TS val 764603498 ecr 317487767], length 84
04:01:14.270655 IP _gateway.51413 > ubuntu.ssh: Flags [.], ack 8673, win 2030, options [nop,nop,TS val 317487767 ecr 764603497], length 0
04:01:14.270677 IP _gateway.51413 > ubuntu.ssh: Flags [.], ack 8757, win 2046, options [nop,nop,TS val 317487767 ecr 764603498], length 0
04:01:14.287271 IP _gateway.51413 > ubuntu.ssh: Flags [P.], seq 400:468, ack 8757, win 2048, options [nop,nop,TS val 317487784 ecr 764603498], length 68
04:01:14.288508 IP _gateway.51413 > ubuntu.ssh: Flags [P.], seq 468:528, ack 8757, win 2048, options [nop,nop,TS val 317487784 ecr 764603498], length 60
04:01:14.288627 IP ubuntu.ssh > _gateway.51413: Flags [.], ack 528, win 3551, options [nop,nop,TS val 764603517 ecr 317487784], length 0
04:01:14.326461 IP ubuntu.ssh > _gateway.51413: Flags [P.], seq 8757:9433, ack 528, win 3551, options [nop,nop,TS val 764603555 ecr 317487784], length 676
04:01:14.326819 IP _gateway.51413 > ubuntu.ssh: Flags [.], ack 9433, win 2037, options [nop,nop,TS val 317487822 ecr 764603555], length 0
04:01:14.329198 IP _gateway.51413 > ubuntu.ssh: Flags [P.], seq 528:644, ack 9433, win 2048, options [nop,nop,TS val 317487824 ecr 764603555], length 116
04:01:14.330426 IP _gateway.51413 > ubuntu.ssh: Flags [P.], seq 644:808, ack 9433, win 2048, options [nop,nop,TS val 317487825 ecr 764603555], length 164
04:01:14.330526 IP ubuntu.ssh > _gateway.51413: Flags [.], ack 808, win 3551, options [nop,nop,TS val 764603559 ecr 317487824], length 0
04:01:14.333031 IP ubuntu.ssh > _gateway.51413: Flags [P.], seq 9433:9645, ack 808, win 3551, options [nop,nop,TS val 764603561 ecr 317487824], length 212
04:01:14.333320 IP _gateway.51413 > ubuntu.ssh: Flags [.], ack 9645, win 2044, options [nop,nop,TS val 317487828 ecr 764603561], length 0
04:01:14.366607 IP _gateway.51413 > ubuntu.ssh: Flags [P.], seq 808:868, ack 9645, win 2048, options [nop,nop,TS val 317487861 ecr 764603561], length 60
04:01:14.369730 IP ubuntu.ssh > _gateway.51413: Flags [P.], seq 9645:9713, ack 868, win 3551, options [nop,nop,TS val 764603598 ecr 317487861], length 68
04:01:14.370040 IP _gateway.51413 > ubuntu.ssh: Flags [.], ack 9713, win 2046, options [nop,nop,TS val 317487864 ecr 764603598], length 0
04:01:14.384110 IP _gateway.51413 > ubuntu.ssh: Flags [P.], seq 868:928, ack 9713, win 2048, options [nop,nop,TS val 317487877 ecr 764603598], length 60
04:01:14.386772 IP ubuntu.ssh > _gateway.51413: Flags [P.], seq 9713:9773, ack 928, win 3551, options [nop,nop,TS val 764603615 ecr 317487877], length 60
04:01:14.387104 IP _gateway.51413 > ubuntu.ssh: Flags [.], ack 9773, win 2047, options [nop,nop,TS val 317487879 ecr 764603615], length 0
04:01:14.400520 IP _gateway.51413 > ubuntu.ssh: Flags [P.], seq 928:988, ack 9773, win 2048, options [nop,nop,TS val 317487892 ecr 764603615], length 60
04:01:14.402931 IP ubuntu.ssh > _gateway.51413: Flags [P.], seq 9773:9833, ack 988, win 3551, options [nop,nop,TS val 764603631 ecr 317487892], length 60
04:01:14.403206 IP _gateway.51413 > ubuntu.ssh: Flags [.], ack 9833, win 2047, options [nop,nop,TS val 317487895 ecr 764603631], length 0
04:01:14.432502 IP _gateway.51413 > ubuntu.ssh: Flags [P.], seq 988:1048, ack 9833, win 2048, options [nop,nop,TS val 317487924 ecr 764603631], length 60
04:01:14.433797 IP ubuntu.ssh > _gateway.51413: Flags [P.], seq 9833:11085, ack 1048, win 3551, options [nop,nop,TS val 764603662 ecr 317487924], length 1252
04:01:14.434101 IP _gateway.51413 > ubuntu.ssh: Flags [.], ack 11085, win 2028, options [nop,nop,TS val 317487925 ecr 764603662], length 0
04:01:14.435820 IP _gateway.51413 > ubuntu.ssh: Flags [P.], seq 1048:1108, ack 11085, win 2048, options [nop,nop,TS val 317487926 ecr 764603662], length 60
04:01:14.436069 IP ubuntu.ssh > _gateway.51413: Flags [P.], seq 11085:11153, ack 1108, win 3551, options [nop,nop,TS val 764603664 ecr 317487926], length 68
04:01:14.437102 IP _gateway.51413 > ubuntu.ssh: Flags [.], ack 11153, win 2046, options [nop,nop,TS val 317487926 ecr 764603664], length 0
04:01:14.550038 IP _gateway.51413 > ubuntu.ssh: Flags [P.], seq 1108:1168, ack 11153, win 2048, options [nop,nop,TS val 317488039 ecr 764603664], length 60
04:01:14.552584 IP ubuntu.ssh > _gateway.51413: Flags [P.], seq 11153:11213, ack 1168, win 3551, options [nop,nop,TS val 764603781 ecr 317488039], length 60
04:01:14.552905 IP _gateway.51413 > ubuntu.ssh: Flags [.], ack 11213, win 2047, options [nop,nop,TS val 317488042 ecr 764603781], length 0
04:01:14.582678 IP _gateway.51413 > ubuntu.ssh: Flags [P.], seq 1168:1228, ack 11213, win 2048, options [nop,nop,TS val 317488070 ecr 764603781], length 60
04:01:14.585177 IP ubuntu.ssh > _gateway.51413: Flags [P.], seq 11213:11273, ack 1228, win 3551, options [nop,nop,TS val 764603813 ecr 317488070], length 60
04:01:14.585451 IP _gateway.51413 > ubuntu.ssh: Flags [.], ack 11273, win 2047, options [nop,nop,TS val 317488073 ecr 764603813], length 0
04:01:14.603477 IP _gateway.51413 > ubuntu.ssh: Flags [P.], seq 1228:1288, ack 11273, win 2048, options [nop,nop,TS val 317488090 ecr 764603813], length 60
04:01:14.605671 IP ubuntu.ssh > _gateway.51413: Flags [P.], seq 11273:11333, ack 1288, win 3551, options [nop,nop,TS val 764603834 ecr 317488090], length 60
04:01:14.606000 IP _gateway.51413 > ubuntu.ssh: Flags [.], ack 11333, win 2047, options [nop,nop,TS val 317488092 ecr 764603834], length 0
04:01:14.629293 IP ubuntu.ssh > _gateway.51413: Flags [P.], seq 11333:11401, ack 1288, win 3551, options [nop,nop,TS val 764603858 ecr 317488092], length 68
04:01:14.629707 IP _gateway.51413 > ubuntu.ssh: Flags [.], ack 11401, win 2048, options [nop,nop,TS val 317488115 ecr 764603858], length 0
04:01:14.631364 IP _gateway.51413 > ubuntu.ssh: Flags [P.], seq 1288:1348, ack 11401, win 2048, options [nop,nop,TS val 317488116 ecr 764603858], length 60
04:01:14.637703 IP _gateway.51413 > ubuntu.ssh: Flags [P.], seq 1348:1408, ack 11401, win 2048, options [nop,nop,TS val 317488121 ecr 764603858], length 60
04:01:14.638027 IP ubuntu.ssh > _gateway.51413: Flags [.], ack 1408, win 3551, options [nop,nop,TS val 764603866 ecr 317488116], length 0
04:01:14.640802 IP ubuntu.ssh > _gateway.51413: Flags [P.], seq 11401:11477, ack 1408, win 3551, options [nop,nop,TS val 764603869 ecr 317488116], length 76
04:01:14.641124 IP _gateway.51413 > ubuntu.ssh: Flags [.], ack 11477, win 2048, options [nop,nop,TS val 317488124 ecr 764603869], length 0
04:01:14.689488 IP ubuntu.59674 > _gateway.domain: 21667+ PTR? 2.140.16.172.in-addr.arpa. (43)
04:01:14.719826 IP _gateway.51413 > ubuntu.ssh: Flags [P.], seq 1408:1468, ack 11477, win 2048, options [nop,nop,TS val 317488202 ecr 764603869], length 60
04:01:14.722077 IP ubuntu.ssh > _gateway.51413: Flags [P.], seq 11477:11529, ack 1468, win 3551, options [nop,nop,TS val 764603950 ecr 317488202], length 52
04:01:14.722324 IP _gateway.51413 > ubuntu.ssh: Flags [.], ack 11529, win 2047, options [nop,nop,TS val 317488204 ecr 764603950], length 0
04:01:14.923828 IP _gateway.domain > ubuntu.59674: 21667 NXDomain 0/1/0 (121)
04:01:14.925659 IP ubuntu.39422 > _gateway.domain: 52089+ PTR? 1.140.16.172.in-addr.arpa. (43)
04:01:15.132466 IP _gateway.51413 > ubuntu.ssh: Flags [P.], seq 1468:1528, ack 11529, win 2048, options [nop,nop,TS val 317488612 ecr 764603950], length 60
04:01:15.134811 IP ubuntu.ssh > _gateway.51413: Flags [P.], seq 11529:11589, ack 1528, win 3551, options [nop,nop,TS val 764604363 ecr 317488612], length 60
04:01:15.135118 IP _gateway.51413 > ubuntu.ssh: Flags [.], ack 11589, win 2047, options [nop,nop,TS val 317488614 ecr 764604363], length 0
04:01:15.149354 IP _gateway.51413 > ubuntu.ssh: Flags [P.], seq 1528:1588, ack 11589, win 2048, options [nop,nop,TS val 317488627 ecr 764604363], length 60
04:01:15.151483 IP ubuntu.ssh > _gateway.51413: Flags [P.], seq 11589:11649, ack 1588, win 3551, options [nop,nop,TS val 764604380 ecr 317488627], length 60
04:01:15.151697 IP _gateway.51413 > ubuntu.ssh: Flags [.], ack 11649, win 2047, options [nop,nop,TS val 317488629 ecr 764604380], length 0
04:01:15.237365 IP _gateway.domain > ubuntu.39422: 52089 NXDomain 0/1/0 (121)
04:01:15.292332 IP ubuntu.ssh > _gateway.51413: Flags [P.], seq 11649:11701, ack 1588, win 3551, options [nop,nop,TS val 764604521 ecr 317488629], length 52
04:01:15.292725 IP _gateway.51413 > ubuntu.ssh: Flags [.], ack 11701, win 2047, options [nop,nop,TS val 317488769 ecr 764604521], length 0
04:01:15.294965 IP _gateway.51413 > ubuntu.ssh: Flags [P.], seq 1588:1648, ack 11701, win 2048, options [nop,nop,TS val 317488771 ecr 764604521], length 60
04:01:15.297284 IP ubuntu.ssh > _gateway.51413: Flags [P.], seq 11701:11761, ack 1648, win 3551, options [nop,nop,TS val 764604526 ecr 317488771], length 60
04:01:15.297579 IP _gateway.51413 > ubuntu.ssh: Flags [.], ack 11761, win 2047, options [nop,nop,TS val 317488773 ecr 764604526], length 0
04:01:15.627762 IP _gateway.51413 > ubuntu.ssh: Flags [P.], seq 1648:1708, ack 11761, win 2048, options [nop,nop,TS val 317489101 ecr 764604526], length 60
04:01:15.629879 IP ubuntu.ssh > _gateway.51413: Flags [P.], seq 11761:11821, ack 1708, win 3551, options [nop,nop,TS val 764604858 ecr 317489101], length 60
04:01:15.630094 IP _gateway.51413 > ubuntu.ssh: Flags [.], ack 11821, win 2047, options [nop,nop,TS val 317489103 ecr 764604858], length 0
04:01:15.762256 IP ubuntu.ssh > _gateway.51413: Flags [P.], seq 11821:11865, ack 1708, win 3551, options [nop,nop,TS val 764604990 ecr 317489103], length 44
04:01:15.762511 IP _gateway.51413 > ubuntu.ssh: Flags [.], ack 11865, win 2047, options [nop,nop,TS val 317489234 ecr 764604990], length 0
04:01:15.764315 IP _gateway.51413 > ubuntu.ssh: Flags [P.], seq 1708:1768, ack 11865, win 2048, options [nop,nop,TS val 317489235 ecr 764604990], length 60
04:01:15.767375 IP ubuntu.ssh > _gateway.51413: Flags [P.], seq 11865:11925, ack 1768, win 3551, options [nop,nop,TS val 764604996 ecr 317489235], length 60
04:01:15.767741 IP _gateway.51413 > ubuntu.ssh: Flags [.], ack 11925, win 2047, options [nop,nop,TS val 317489238 ecr 764604996], length 0
04:01:16.236631 IP ubuntu.ssh > _gateway.51413: Flags [P.], seq 11925:11977, ack 1768, win 3551, options [nop,nop,TS val 764605465 ecr 317489238], length 52
04:01:16.236878 IP _gateway.51413 > ubuntu.ssh: Flags [.], ack 11977, win 2047, options [nop,nop,TS val 317489706 ecr 764605465], length 0
04:01:17.673719 IP _gateway.51413 > ubuntu.ssh: Flags [P.], seq 1768:1836, ack 11977, win 2048, options [nop,nop,TS val 317491136 ecr 764605465], length 68
04:01:17.676197 IP ubuntu.ssh > _gateway.51413: Flags [P.], seq 11977:12045, ack 1836, win 3551, options [nop,nop,TS val 764606904 ecr 317491136], length 68
04:01:17.676481 IP _gateway.51413 > ubuntu.ssh: Flags [.], ack 12045, win 2046, options [nop,nop,TS val 317491138 ecr 764606904], length 0
04:01:17.702555 IP _gateway.51413 > ubuntu.ssh: Flags [P.], seq 1836:1896, ack 12045, win 2048, options [nop,nop,TS val 317491163 ecr 764606904], length 60
04:01:17.703751 IP _gateway.51413 > ubuntu.ssh: Flags [P.], seq 1896:1972, ack 12045, win 2048, options [nop,nop,TS val 317491163 ecr 764606904], length 76
04:01:17.703851 IP ubuntu.ssh > _gateway.51413: Flags [.], ack 1972, win 3551, options [nop,nop,TS val 764606932 ecr 317491163], length 0
04:01:17.706115 IP ubuntu.ssh > _gateway.51413: Flags [P.], seq 12045:12113, ack 1972, win 3551, options [nop,nop,TS val 764606934 ecr 317491163], length 68
04:01:17.706333 IP _gateway.51413 > ubuntu.ssh: Flags [.], ack 12113, win 2046, options [nop,nop,TS val 317491166 ecr 764606934], length 0
04:01:17.707183 IP ubuntu.ssh > _gateway.51413: Flags [P.], seq 12113:12173, ack 1972, win 3551, options [nop,nop,TS val 764606935 ecr 317491166], length 60
04:01:17.707388 IP _gateway.51413 > ubuntu.ssh: Flags [.], ack 12173, win 2047, options [nop,nop,TS val 317491167 ecr 764606935], length 0
04:01:17.708452 IP _gateway.51413 > ubuntu.ssh: Flags [P.], seq 1972:2032, ack 12173, win 2048, options [nop,nop,TS val 317491167 ecr 764606935], length 60
04:01:17.710557 IP ubuntu.ssh > _gateway.51413: Flags [P.], seq 12173:12233, ack 2032, win 3551, options [nop,nop,TS val 764606939 ecr 317491167], length 60
04:01:17.710779 IP _gateway.51413 > ubuntu.ssh: Flags [.], ack 12233, win 2047, options [nop,nop,TS val 317491170 ecr 764606939], length 0
04:01:17.715128 IP _gateway.51413 > ubuntu.ssh: Flags [P.], seq 2032:2092, ack 12233, win 2048, options [nop,nop,TS val 317491174 ecr 764606939], length 60
04:01:17.716121 IP _gateway.51413 > ubuntu.ssh: Flags [P.], seq 2092:2152, ack 12233, win 2048, options [nop,nop,TS val 317491174 ecr 764606939], length 60
04:01:17.716235 IP ubuntu.ssh > _gateway.51413: Flags [.], ack 2152, win 3551, options [nop,nop,TS val 764606944 ecr 317491174], length 0
04:01:17.717778 IP ubuntu.ssh > _gateway.51413: Flags [P.], seq 12233:12285, ack 2152, win 3551, options [nop,nop,TS val 764606946 ecr 317491174], length 52
04:01:17.718148 IP _gateway.51413 > ubuntu.ssh: Flags [.], ack 12285, win 2047, options [nop,nop,TS val 317491176 ecr 764606946], length 0
04:01:17.718298 IP ubuntu.ssh > _gateway.51413: Flags [P.], seq 12285:12345, ack 2152, win 3551, options [nop,nop,TS val 764606947 ecr 317491176], length 60
04:01:17.719191 IP _gateway.51413 > ubuntu.ssh: Flags [.], ack 12345, win 2047, options [nop,nop,TS val 317491176 ecr 764606947], length 0
04:01:17.720477 IP _gateway.51413 > ubuntu.ssh: Flags [P.], seq 2152:2220, ack 12345, win 2048, options [nop,nop,TS val 317491177 ecr 764606947], length 68
04:01:17.722425 IP ubuntu.ssh > _gateway.51413: Flags [P.], seq 12345:12405, ack 2220, win 3551, options [nop,nop,TS val 764606951 ecr 317491177], length 60
04:01:17.722682 IP _gateway.51413 > ubuntu.ssh: Flags [.], ack 12405, win 2047, options [nop,nop,TS val 317491179 ecr 764606951], length 0
04:01:17.763939 IP _gateway.51413 > ubuntu.ssh: Flags [P.], seq 2220:2280, ack 12405, win 2048, options [nop,nop,TS val 317491220 ecr 764606951], length 60
04:01:17.766088 IP ubuntu.ssh > _gateway.51413: Flags [P.], seq 12405:12465, ack 2280, win 3551, options [nop,nop,TS val 764606994 ecr 317491220], length 60
04:01:17.766362 IP _gateway.51413 > ubuntu.ssh: Flags [.], ack 12465, win 2047, options [nop,nop,TS val 317491222 ecr 764606994], length 0
04:01:17.780723 IP _gateway.51413 > ubuntu.ssh: Flags [P.], seq 2280:2340, ack 12465, win 2048, options [nop,nop,TS val 317491236 ecr 764606994], length 60
04:01:17.782757 IP ubuntu.ssh > _gateway.51413: Flags [P.], seq 12465:12525, ack 2340, win 3551, options [nop,nop,TS val 764607011 ecr 317491236], length 60
04:01:17.783972 IP _gateway.51413 > ubuntu.ssh: Flags [.], ack 12525, win 2047, options [nop,nop,TS val 317491239 ecr 764607011], length 0
04:01:17.796960 IP _gateway.51413 > ubuntu.ssh: Flags [P.], seq 2340:2400, ack 12525, win 2048, options [nop,nop,TS val 317491251 ecr 764607011], length 60
04:01:17.799090 IP ubuntu.ssh > _gateway.51413: Flags [P.], seq 12525:12585, ack 2400, win 3551, options [nop,nop,TS val 764607027 ecr 317491251], length 60
04:01:17.799332 IP _gateway.51413 > ubuntu.ssh: Flags [.], ack 12585, win 2047, options [nop,nop,TS val 317491253 ecr 764607027], length 0
04:01:17.811503 IP ubuntu.ssh > _gateway.51413: Flags [P.], seq 12585:12637, ack 2400, win 3551, options [nop,nop,TS val 764607040 ecr 317491253], length 52
04:01:17.811735 IP _gateway.51413 > ubuntu.ssh: Flags [.], ack 12637, win 2047, options [nop,nop,TS val 317491265 ecr 764607040], length 0
04:01:17.813590 IP _gateway.51413 > ubuntu.ssh: Flags [P.], seq 2400:2460, ack 12637, win 2048, options [nop,nop,TS val 317491266 ecr 764607040], length 60
04:01:17.816041 IP ubuntu.ssh > _gateway.51413: Flags [P.], seq 12637:12697, ack 2460, win 3551, options [nop,nop,TS val 764607044 ecr 317491266], length 60
04:01:17.816322 IP _gateway.51413 > ubuntu.ssh: Flags [.], ack 12697, win 2047, options [nop,nop,TS val 317491268 ecr 764607044], length 0
04:01:17.847482 IP _gateway.51413 > ubuntu.ssh: Flags [P.], seq 2460:2520, ack 12697, win 2048, options [nop,nop,TS val 317491298 ecr 764607044], length 60
04:01:17.850169 IP ubuntu.ssh > _gateway.51413: Flags [P.], seq 12697:12757, ack 2520, win 3551, options [nop,nop,TS val 764607078 ecr 317491298], length 60
04:01:17.850489 IP _gateway.51413 > ubuntu.ssh: Flags [.], ack 12757, win 2047, options [nop,nop,TS val 317491301 ecr 764607078], length 0
04:01:18.174186 IP _gateway.51413 > ubuntu.ssh: Flags [P.], seq 2520:2580, ack 12757, win 2048, options [nop,nop,TS val 317491621 ecr 764607078], length 60
04:01:18.177068 IP ubuntu.ssh > _gateway.51413: Flags [P.], seq 12757:12809, ack 2580, win 3551, options [nop,nop,TS val 764607405 ecr 317491621], length 52
04:01:18.177337 IP _gateway.51413 > ubuntu.ssh: Flags [.], ack 12809, win 2047, options [nop,nop,TS val 317491624 ecr 764607405], length 0
04:01:18.646289 IP _gateway.51413 > ubuntu.ssh: Flags [P.], seq 2580:2640, ack 12809, win 2048, options [nop,nop,TS val 317492091 ecr 764607405], length 60
04:01:18.646361 IP _gateway.51413 > ubuntu.ssh: Flags [P.], seq 2640:2700, ack 12809, win 2048, options [nop,nop,TS val 317492091 ecr 764607405], length 60
04:01:18.646534 IP ubuntu.ssh > _gateway.51413: Flags [.], ack 2700, win 3551, options [nop,nop,TS val 764607875 ecr 317492091], length 0
04:01:18.650130 IP ubuntu.ssh > _gateway.51413: Flags [P.], seq 12809:12929, ack 2700, win 3551, options [nop,nop,TS val 764607878 ecr 317492091], length 120
04:01:18.650355 IP _gateway.51413 > ubuntu.ssh: Flags [.], ack 12929, win 2046, options [nop,nop,TS val 317492095 ecr 764607878], length 0
04:01:18.658302 IP ubuntu.ssh > _gateway.51413: Flags [P.], seq 12929:13029, ack 2700, win 3551, options [nop,nop,TS val 764607887 ecr 317492095], length 100
04:01:18.658565 IP _gateway.51413 > ubuntu.ssh: Flags [.], ack 13029, win 2046, options [nop,nop,TS val 317492103 ecr 764607887], length 0
04:01:18.658796 IP ubuntu.ssh > _gateway.51413: Flags [P.], seq 13029:13081, ack 2700, win 3551, options [nop,nop,TS val 764607887 ecr 317492103], length 52
04:01:18.659997 IP _gateway.51413 > ubuntu.ssh: Flags [.], ack 13081, win 2047, options [nop,nop,TS val 317492104 ecr 764607887], length 0
04:01:18.690104 IP ubuntu.17664 > ubuntu.82: Flags [.], seq 1881210880:1881210940, ack 1074895445, win 35842, options [eol], length 60
04:01:18.731468 IP ubuntu.ssh > _gateway.51413: Flags [P.], seq 13081:13133, ack 2700, win 3551, options [nop,nop,TS val 764607960 ecr 317492104], length 52
04:01:18.731760 IP _gateway.51413 > ubuntu.ssh: Flags [.], ack 13133, win 2047, options [nop,nop,TS val 317492174 ecr 764607960], length 0
04:01:18.762109 IP ubuntu.17664 > ubuntu.82: Flags [.], seq 0:60, ack 1, win 35842, options [eol], length 60
04:01:18.795698 IP ubuntu.ssh > _gateway.51413: Flags [P.], seq 13133:13177, ack 2700, win 3551, options [nop,nop,TS val 764608024 ecr 317492174], length 44
04:01:18.796037 IP _gateway.51413 > ubuntu.ssh: Flags [.], ack 13177, win 2047, options [nop,nop,TS val 317492238 ecr 764608024], length 0
04:01:18.818517 IP ubuntu.ssh > _gateway.51413: Flags [P.], seq 13177:13229, ack 2700, win 3551, options [nop,nop,TS val 764608047 ecr 317492238], length 52
04:01:18.818836 IP _gateway.51413 > ubuntu.ssh: Flags [.], ack 13229, win 2047, options [nop,nop,TS val 317492260 ecr 764608047], length 0
04:01:18.821119 IP _gateway.51413 > ubuntu.ssh: Flags [P.], seq 2700:2768, ack 13229, win 2048, options [nop,nop,TS val 317492262 ecr 764608047], length 68
04:01:18.822809 IP ubuntu.ssh > _gateway.51413: Flags [P.], seq 13229:13297, ack 2768, win 3551, options [nop,nop,TS val 764608051 ecr 317492262], length 68
04:01:18.822975 IP _gateway.51413 > ubuntu.ssh: Flags [.], ack 13297, win 2046, options [nop,nop,TS val 317492264 ecr 764608051], length 0
04:01:18.826418 IP ubuntu.17664 > ubuntu.82: Flags [.], seq 0:60, ack 1, win 35842, options [eol], length 60
04:01:18.839832 IP ubuntu.ssh > _gateway.51413: Flags [P.], seq 13297:13349, ack 2768, win 3551, options [nop,nop,TS val 764608068 ecr 317492264], length 52
04:01:18.840178 IP _gateway.51413 > ubuntu.ssh: Flags [.], ack 13349, win 2047, options [nop,nop,TS val 317492281 ecr 764608068], length 0
04:01:18.842134 IP _gateway.51413 > ubuntu.ssh: Flags [P.], seq 2768:2828, ack 13349, win 2048, options [nop,nop,TS val 317492282 ecr 764608068], length 60
04:01:18.844306 IP ubuntu.ssh > _gateway.51413: Flags [P.], seq 13349:13409, ack 2828, win 3551, options [nop,nop,TS val 764608073 ecr 317492282], length 60
04:01:18.844504 IP _gateway.51413 > ubuntu.ssh: Flags [.], ack 13409, win 2047, options [nop,nop,TS val 317492284 ecr 764608073], length 0
04:01:18.868484 IP ubuntu.ssh > _gateway.51413: Flags [P.], seq 13409:13453, ack 2828, win 3551, options [nop,nop,TS val 764608097 ecr 317492284], length 44
04:01:18.868899 IP _gateway.51413 > ubuntu.ssh: Flags [.], ack 13453, win 2047, options [nop,nop,TS val 317492308 ecr 764608097], length 0
04:01:18.914651 IP ubuntu.17664 > ubuntu.82: Flags [.], seq 0:60, ack 1, win 35842, options [eol], length 60
04:01:18.948177 IP ubuntu.ssh > _gateway.51413: Flags [P.], seq 13453:13497, ack 2828, win 3551, options [nop,nop,TS val 764608176 ecr 317492308], length 44
04:01:18.949649 IP _gateway.51413 > ubuntu.ssh: Flags [.], ack 13497, win 2047, options [nop,nop,TS val 317492388 ecr 764608176], length 0
04:01:18.978466 IP ubuntu.17664 > ubuntu.82: Flags [.], seq 0:60, ack 1, win 35842, options [eol], length 60
04:01:19.012477 IP ubuntu.ssh > _gateway.51413: Flags [P.], seq 13497:13541, ack 2828, win 3551, options [nop,nop,TS val 764608241 ecr 317492388], length 44
04:01:19.014682 IP _gateway.51413 > ubuntu.ssh: Flags [.], ack 13541, win 2047, options [nop,nop,TS val 317492452 ecr 764608241], length 0
04:01:19.042775 IP ubuntu.17664 > ubuntu.82: Flags [.], seq 0:60, ack 1, win 35842, options [eol], length 60
04:01:19.076552 IP ubuntu.ssh > _gateway.51413: Flags [P.], seq 13541:13585, ack 2828, win 3551, options [nop,nop,TS val 764608305 ecr 317492452], length 44
04:01:19.076964 IP _gateway.51413 > ubuntu.ssh: Flags [.], ack 13585, win 2047, options [nop,nop,TS val 317492514 ecr 764608305], length 0
04:01:19.106305 IP ubuntu.17664 > ubuntu.82: Flags [.], seq 0:60, ack 1, win 35842, options [eol], length 60
04:01:19.140877 IP ubuntu.ssh > _gateway.51413: Flags [P.], seq 13585:13629, ack 2828, win 3551, options [nop,nop,TS val 764608369 ecr 317492514], length 44
04:01:19.141275 IP _gateway.51413 > ubuntu.ssh: Flags [.], ack 13629, win 2047, options [nop,nop,TS val 317492576 ecr 764608369], length 0
04:01:19.170616 IP ubuntu.17664 > ubuntu.82: Flags [.], seq 0:60, ack 1, win 35842, options [eol], length 60
04:01:19.204586 IP ubuntu.ssh > _gateway.51413: Flags [P.], seq 13629:13673, ack 2828, win 3551, options [nop,nop,TS val 764608433 ecr 317492576], length 44
04:01:19.204985 IP _gateway.51413 > ubuntu.ssh: Flags [.], ack 13673, win 2047, options [nop,nop,TS val 317492638 ecr 764608433], length 0
04:01:19.238059 IP ubuntu.17664 > ubuntu.82: Flags [.], seq 0:60, ack 1, win 35842, options [eol], length 60
04:01:19.272717 IP ubuntu.ssh > _gateway.51413: Flags [P.], seq 13673:13717, ack 2828, win 3551, options [nop,nop,TS val 764608501 ecr 317492638], length 44
04:01:19.273123 IP _gateway.51413 > ubuntu.ssh: Flags [.], ack 13717, win 2047, options [nop,nop,TS val 317492706 ecr 764608501], length 0
04:01:19.302094 IP ubuntu.17664 > ubuntu.82: Flags [.], seq 0:60, ack 1, win 35842, options [eol], length 60
04:01:19.323940 IP _gateway.51413 > ubuntu.ssh: Flags [P.], seq 2828:2888, ack 13717, win 2048, options [nop,nop,TS val 317492756 ecr 764608501], length 60
04:01:19.327869 IP ubuntu.ssh > _gateway.51413: Flags [P.], seq 13717:13769, ack 2888, win 3551, options [nop,nop,TS val 764608556 ecr 317492756], length 52
04:01:19.328161 IP _gateway.51413 > ubuntu.ssh: Flags [.], ack 13769, win 2047, options [nop,nop,TS val 317492760 ecr 764608556], length 0
04:01:19.335232 IP ubuntu.ssh > _gateway.51413: Flags [P.], seq 13769:13821, ack 2888, win 3551, options [nop,nop,TS val 764608563 ecr 317492760], length 52
04:01:19.335564 IP _gateway.51413 > ubuntu.ssh: Flags [.], ack 13821, win 2048, options [nop,nop,TS val 317492767 ecr 764608563], length 0
04:01:19.343955 IP ubuntu.ssh > _gateway.51413: Flags [P.], seq 13821:21061, ack 2888, win 3551, options [nop,nop,TS val 764608572 ecr 317492767], length 7240
04:01:19.344067 IP ubuntu.ssh > _gateway.51413: Flags [P.], seq 21061:22169, ack 2888, win 3551, options [nop,nop,TS val 764608572 ecr 317492767], length 1108
04:01:19.344265 IP _gateway.51413 > ubuntu.ssh: Flags [.], ack 16717, win 2002, options [nop,nop,TS val 317492775 ecr 764608572], length 0
04:01:19.344312 IP _gateway.51413 > ubuntu.ssh: Flags [.], ack 19613, win 1957, options [nop,nop,TS val 317492775 ecr 764608572], length 0
04:01:19.344332 IP _gateway.51413 > ubuntu.ssh: Flags [.], ack 22169, win 1917, options [nop,nop,TS val 317492775 ecr 764608572], length 0
04:01:19.344354 IP _gateway.51413 > ubuntu.ssh: Flags [.], ack 22169, win 2048, options [nop,nop,TS val 317492775 ecr 764608572], length 0
04:01:19.347827 IP _gateway.51413 > ubuntu.ssh: Flags [P.], seq 2888:2956, ack 22169, win 2048, options [nop,nop,TS val 317492778 ecr 764608572], length 68
04:01:19.358049 IP ubuntu.ssh > _gateway.51413: Flags [P.], seq 22169:22253, ack 2956, win 3551, options [nop,nop,TS val 764608586 ecr 317492778], length 84
04:01:19.358344 IP _gateway.51413 > ubuntu.ssh: Flags [.], ack 22253, win 2046, options [nop,nop,TS val 317492788 ecr 764608586], length 0
04:01:19.359771 IP _gateway.51413 > ubuntu.ssh: Flags [P.], seq 2956:3016, ack 22253, win 2048, options [nop,nop,TS val 317492789 ecr 764608586], length 60
04:01:19.362210 IP ubuntu.17664 > ubuntu.82: Flags [.], seq 0:60, ack 1, win 35842, options [eol], length 60
04:01:19.391764 IP ubuntu.ssh > _gateway.51413: Flags [P.], seq 22253:22297, ack 3016, win 3551, options [nop,nop,TS val 764608620 ecr 317492789], length 44
04:01:19.392046 IP _gateway.51413 > ubuntu.ssh: Flags [.], ack 22297, win 2047, options [nop,nop,TS val 317492821 ecr 764608620], length 0
04:01:19.404532 IP ubuntu.ssh > _gateway.51413: Flags [P.], seq 22297:22973, ack 3016, win 3551, options [nop,nop,TS val 764608633 ecr 317492821], length 676
04:01:19.404920 IP _gateway.51413 > ubuntu.ssh: Flags [.], ack 22973, win 2048, options [nop,nop,TS val 317492833 ecr 764608633], length 0
04:01:19.407142 IP _gateway.51413 > ubuntu.ssh: Flags [P.], seq 3016:3132, ack 22973, win 2048, options [nop,nop,TS val 317492835 ecr 764608633], length 116
04:01:19.408390 IP _gateway.51413 > ubuntu.ssh: Flags [P.], seq 3132:3352, ack 22973, win 2048, options [nop,nop,TS val 317492835 ecr 764608633], length 220
04:01:19.408492 IP ubuntu.ssh > _gateway.51413: Flags [.], ack 3352, win 3551, options [nop,nop,TS val 764608637 ecr 317492835], length 0
04:01:19.410502 IP ubuntu.ssh > _gateway.51413: Flags [P.], seq 22973:23177, ack 3352, win 3551, options [nop,nop,TS val 764608639 ecr 317492835], length 204
04:01:19.410734 IP _gateway.51413 > ubuntu.ssh: Flags [.], ack 23177, win 2048, options [nop,nop,TS val 317492838 ecr 764608639], length 0
04:01:19.422876 IP ubuntu.17664 > ubuntu.82: Flags [.], seq 0:60, ack 1, win 35842, options [eol], length 60
04:01:19.467581 IP ubuntu.ssh > _gateway.51413: Flags [P.], seq 23177:23221, ack 3352, win 3551, options [nop,nop,TS val 764608696 ecr 317492838], length 44
04:01:19.467919 IP _gateway.51413 > ubuntu.ssh: Flags [.], ack 23221, win 2048, options [nop,nop,TS val 317492894 ecr 764608696], length 0
04:01:19.498059 IP ubuntu.17664 > ubuntu.82: Flags [.], seq 0:60, ack 1, win 35842, options [eol], length 60
04:01:19.514014 IP ubuntu.ssh > _gateway.51413: Flags [P.], seq 23221:24473, ack 3352, win 3551, options [nop,nop,TS val 764608742 ecr 317492894], length 1252
04:01:19.514318 IP _gateway.51413 > ubuntu.ssh: Flags [.], ack 24473, win 2048, options [nop,nop,TS val 317492940 ecr 764608742], length 0
04:01:19.517879 IP _gateway.51413 > ubuntu.ssh: Flags [P.], seq 3352:3420, ack 24473, win 2048, options [nop,nop,TS val 317492943 ecr 764608742], length 68
04:01:19.531667 IP ubuntu.ssh > _gateway.51413: Flags [P.], seq 24473:24517, ack 3420, win 3551, options [nop,nop,TS val 764608760 ecr 317492943], length 44
04:01:19.531946 IP _gateway.51413 > ubuntu.ssh: Flags [.], ack 24517, win 2047, options [nop,nop,TS val 317492957 ecr 764608760], length 0
04:01:19.562596 IP ubuntu.17664 > ubuntu.82: Flags [.], seq 0:60, ack 1, win 35842, options [eol], length 60
04:01:19.596496 IP ubuntu.ssh > _gateway.51413: Flags [P.], seq 24517:24561, ack 3420, win 3551, options [nop,nop,TS val 764608825 ecr 317492957], length 44
04:01:19.597098 IP _gateway.51413 > ubuntu.ssh: Flags [.], ack 24561, win 2048, options [nop,nop,TS val 317493021 ecr 764608825], length 0
04:01:19.626122 IP ubuntu.17664 > ubuntu.82: Flags [.], seq 0:60, ack 1, win 35842, options [eol], length 60
04:01:19.637095 IP _gateway.51413 > ubuntu.ssh: Flags [P.], seq 3420:3480, ack 24561, win 2048, options [nop,nop,TS val 317493060 ecr 764608825], length 60
04:01:19.638858 IP ubuntu.ssh > _gateway.51413: Flags [P.], seq 24561:24621, ack 3480, win 3551, options [nop,nop,TS val 764608867 ecr 317493060], length 60
04:01:19.639061 IP _gateway.51413 > ubuntu.ssh: Flags [.], ack 24621, win 2047, options [nop,nop,TS val 317493062 ecr 764608867], length 0
04:01:19.662999 IP ubuntu.ssh > _gateway.51413: Flags [P.], seq 24621:24665, ack 3480, win 3551, options [nop,nop,TS val 764608891 ecr 317493062], length 44
04:01:19.663371 IP _gateway.51413 > ubuntu.ssh: Flags [.], ack 24665, win 2047, options [nop,nop,TS val 317493086 ecr 764608891], length 0
04:01:19.686108 IP ubuntu.17664 > ubuntu.82: Flags [.], seq 0:60, ack 1, win 35842, options [eol], length 60
04:01:19.708561 IP ubuntu.ssh > _gateway.51413: Flags [P.], seq 24665:24709, ack 3480, win 3551, options [nop,nop,TS val 764608937 ecr 317493086], length 44
04:01:19.708874 IP _gateway.51413 > ubuntu.ssh: Flags [.], ack 24709, win 2048, options [nop,nop,TS val 317493131 ecr 764608937], length 0
04:01:19.709007 IP ubuntu.ssh > _gateway.51413: Flags [P.], seq 24709:24777, ack 3480, win 3551, options [nop,nop,TS val 764608937 ecr 317493131], length 68
04:01:19.710114 IP _gateway.51413 > ubuntu.ssh: Flags [.], ack 24777, win 2048, options [nop,nop,TS val 317493131 ecr 764608937], length 0
04:01:19.711368 IP _gateway.51413 > ubuntu.ssh: Flags [P.], seq 3480:3540, ack 24777, win 2048, options [nop,nop,TS val 317493132 ecr 764608937], length 60
04:01:19.718487 IP _gateway.51413 > ubuntu.ssh: Flags [P.], seq 3540:3600, ack 24777, win 2048, options [nop,nop,TS val 317493139 ecr 764608937], length 60
04:01:19.718629 IP ubuntu.ssh > _gateway.51413: Flags [.], ack 3600, win 3551, options [nop,nop,TS val 764608947 ecr 317493132], length 0
04:01:19.720241 IP ubuntu.ssh > _gateway.51413: Flags [P.], seq 24777:24853, ack 3600, win 3551, options [nop,nop,TS val 764608948 ecr 317493132], length 76
04:01:19.720451 IP _gateway.51413 > ubuntu.ssh: Flags [.], ack 24853, win 2048, options [nop,nop,TS val 317493141 ecr 764608948], length 0
04:01:19.738155 IP ubuntu.17664 > ubuntu.82: Flags [.], seq 0:60, ack 1, win 35842, options [eol], length 60
04:01:19.771202 IP ubuntu.ssh > _gateway.51413: Flags [P.], seq 24853:24897, ack 3600, win 3551, options [nop,nop,TS val 764608999 ecr 317493141], length 44
04:01:19.771460 IP _gateway.51413 > ubuntu.ssh: Flags [.], ack 24897, win 2048, options [nop,nop,TS val 317493191 ecr 764608999], length 0
04:01:19.806327 IP ubuntu.17664 > ubuntu.82: Flags [.], seq 0:60, ack 1, win 35842, options [eol], length 60
04:01:19.843234 IP ubuntu.ssh > _gateway.51413: Flags [P.], seq 24897:24941, ack 3600, win 3551, options [nop,nop,TS val 764609071 ecr 317493191], length 44
04:01:19.843511 IP _gateway.51413 > ubuntu.ssh: Flags [.], ack 24941, win 2048, options [nop,nop,TS val 317493262 ecr 764609071], length 0
04:01:19.859166 IP ubuntu.ssh > _gateway.51413: Flags [P.], seq 24941:24993, ack 3600, win 3551, options [nop,nop,TS val 764609087 ecr 317493262], length 52
04:01:19.859422 IP _gateway.51413 > ubuntu.ssh: Flags [.], ack 24993, win 2048, options [nop,nop,TS val 317493277 ecr 764609087], length 0
04:01:19.860974 IP _gateway.51413 > ubuntu.ssh: Flags [P.], seq 3600:3660, ack 24993, win 2048, options [nop,nop,TS val 317493278 ecr 764609087], length 60
04:01:19.862918 IP ubuntu.ssh > _gateway.51413: Flags [P.], seq 24993:25053, ack 3660, win 3551, options [nop,nop,TS val 764609091 ecr 317493278], length 60
04:01:19.863168 IP _gateway.51413 > ubuntu.ssh: Flags [.], ack 25053, win 2047, options [nop,nop,TS val 317493280 ecr 764609091], length 0
04:01:19.874210 IP ubuntu.17664 > ubuntu.82: Flags [.], seq 0:60, ack 1, win 35842, options [eol], length 60
04:01:19.907089 IP ubuntu.ssh > _gateway.51413: Flags [P.], seq 25053:25097, ack 3660, win 3551, options [nop,nop,TS val 764609135 ecr 317493280], length 44
04:01:19.907326 IP _gateway.51413 > ubuntu.ssh: Flags [.], ack 25097, win 2047, options [nop,nop,TS val 317493324 ecr 764609135], length 0
04:01:19.938052 IP ubuntu.17664 > ubuntu.82: Flags [.], seq 0:60, ack 1, win 35842, options [eol], length 60
04:01:19.971224 IP ubuntu.ssh > _gateway.51413: Flags [P.], seq 25097:25141, ack 3660, win 3551, options [nop,nop,TS val 764609199 ecr 317493324], length 44
04:01:19.971490 IP _gateway.51413 > ubuntu.ssh: Flags [.], ack 25141, win 2048, options [nop,nop,TS val 317493387 ecr 764609199], length 0
04:01:19.998123 IP ubuntu.17664 > ubuntu.82: Flags [.], seq 0:60, ack 1, win 35842, options [eol], length 60
04:01:20.031280 IP ubuntu.ssh > _gateway.51413: Flags [P.], seq 25141:25185, ack 3660, win 3551, options [nop,nop,TS val 764609260 ecr 317493387], length 44
04:01:20.031626 IP _gateway.51413 > ubuntu.ssh: Flags [.], ack 25185, win 2048, options [nop,nop,TS val 317493446 ecr 764609260], length 0
04:01:20.063211 IP ubuntu.17664 > ubuntu.82: Flags [.], seq 0:60, ack 1, win 35842, options [eol], length 60
04:01:20.103334 IP ubuntu.ssh > _gateway.51413: Flags [P.], seq 25185:25229, ack 3660, win 3551, options [nop,nop,TS val 764609332 ecr 317493446], length 44
04:01:20.103645 IP _gateway.51413 > ubuntu.ssh: Flags [.], ack 25229, win 2048, options [nop,nop,TS val 317493518 ecr 764609332], length 0
04:01:20.138110 IP ubuntu.17664 > ubuntu.82: Flags [.], seq 0:60, ack 1, win 35842, options [eol], length 60
04:01:20.176175 IP ubuntu.ssh > _gateway.51413: Flags [P.], seq 25229:25273, ack 3660, win 3551, options [nop,nop,TS val 764609404 ecr 317493518], length 44
04:01:20.176565 IP _gateway.51413 > ubuntu.ssh: Flags [.], ack 25273, win 2048, options [nop,nop,TS val 317493589 ecr 764609404], length 0
04:01:20.206436 IP ubuntu.17664 > ubuntu.82: Flags [.], seq 0:60, ack 1, win 35842, options [eol], length 60
04:01:20.239581 IP ubuntu.ssh > _gateway.51413: Flags [P.], seq 25273:25317, ack 3660, win 3551, options [nop,nop,TS val 764609468 ecr 317493589], length 44
04:01:20.241070 IP _gateway.51413 > ubuntu.ssh: Flags [.], ack 25317, win 2048, options [nop,nop,TS val 317493653 ecr 764609468], length 0
04:01:20.286742 IP ubuntu.17664 > ubuntu.82: Flags [.], seq 0:60, ack 1, win 35842, options [eol], length 60
04:01:20.320521 IP ubuntu.ssh > _gateway.51413: Flags [P.], seq 25317:25361, ack 3660, win 3551, options [nop,nop,TS val 764609549 ecr 317493653], length 44
04:01:20.320943 IP _gateway.51413 > ubuntu.ssh: Flags [.], ack 25361, win 2048, options [nop,nop,TS val 317493732 ecr 764609549], length 0
04:01:20.350079 IP ubuntu.17664 > ubuntu.82: Flags [.], seq 0:60, ack 1, win 35842, options [eol], length 60
04:01:20.379606 IP ubuntu.ssh > _gateway.51413: Flags [P.], seq 25361:25405, ack 3660, win 3551, options [nop,nop,TS val 764609608 ecr 317493732], length 44
04:01:20.379875 IP _gateway.51413 > ubuntu.ssh: Flags [.], ack 25405, win 2048, options [nop,nop,TS val 317493790 ecr 764609608], length 0
04:01:20.410055 IP ubuntu.17664 > ubuntu.82: Flags [.], seq 0:60, ack 1, win 35842, options [eol], length 60
04:01:20.443871 IP ubuntu.ssh > _gateway.51413: Flags [P.], seq 25405:25449, ack 3660, win 3551, options [nop,nop,TS val 764609672 ecr 317493790], length 44
04:01:20.444155 IP _gateway.51413 > ubuntu.ssh: Flags [.], ack 25449, win 2048, options [nop,nop,TS val 317493853 ecr 764609672], length 0
04:01:20.474122 IP ubuntu.17664 > ubuntu.82: Flags [.], seq 0:60, ack 1, win 35842, options [eol], length 60
04:01:20.507128 IP ubuntu.ssh > _gateway.51413: Flags [P.], seq 25449:25493, ack 3660, win 3551, options [nop,nop,TS val 764609735 ecr 317493853], length 44
04:01:20.507472 IP _gateway.51413 > ubuntu.ssh: Flags [.], ack 25493, win 2048, options [nop,nop,TS val 317493916 ecr 764609735], length 0
04:01:20.538319 IP ubuntu.17664 > ubuntu.82: Flags [.], seq 0:60, ack 1, win 35842, options [eol], length 60
04:01:20.573252 IP ubuntu.ssh > _gateway.51413: Flags [P.], seq 25493:25537, ack 3660, win 3551, options [nop,nop,TS val 764609801 ecr 317493916], length 44
04:01:20.573721 IP _gateway.51413 > ubuntu.ssh: Flags [.], ack 25537, win 2048, options [nop,nop,TS val 317493982 ecr 764609801], length 0
04:01:20.602594 IP ubuntu.17664 > ubuntu.82: Flags [.], seq 0:60, ack 1, win 35842, options [eol], length 60
04:01:20.636239 IP ubuntu.ssh > _gateway.51413: Flags [P.], seq 25537:25581, ack 3660, win 3551, options [nop,nop,TS val 764609864 ecr 317493982], length 44
04:01:20.636632 IP _gateway.51413 > ubuntu.ssh: Flags [.], ack 25581, win 2048, options [nop,nop,TS val 317494044 ecr 764609864], length 0
04:01:20.648363 IP _gateway.51413 > ubuntu.ssh: Flags [P.], seq 3660:3720, ack 25581, win 2048, options [nop,nop,TS val 317494055 ecr 764609864], length 60
04:01:20.651297 IP ubuntu.ssh > _gateway.51413: Flags [P.], seq 25581:25641, ack 3720, win 3551, options [nop,nop,TS val 764609880 ecr 317494055], length 60
04:01:20.651543 IP _gateway.51413 > ubuntu.ssh: Flags [.], ack 25641, win 2047, options [nop,nop,TS val 317494058 ecr 764609880], length 0
04:01:20.666516 IP ubuntu.17664 > ubuntu.82: Flags [.], seq 0:60, ack 1, win 35842, options [eol], length 60
04:01:20.699649 IP ubuntu.ssh > _gateway.51413: Flags [P.], seq 25641:25693, ack 3720, win 3551, options [nop,nop,TS val 764609928 ecr 317494058], length 52
04:01:20.699909 IP _gateway.51413 > ubuntu.ssh: Flags [.], ack 25693, win 2047, options [nop,nop,TS val 317494106 ecr 764609928], length 0
04:01:20.725412 IP ubuntu.ssh > _gateway.51413: Flags [P.], seq 25693:25745, ack 3720, win 3551, options [nop,nop,TS val 764609954 ecr 317494106], length 52
04:01:20.725712 IP _gateway.51413 > ubuntu.ssh: Flags [.], ack 25745, win 2048, options [nop,nop,TS val 317494131 ecr 764609954], length 0
04:01:20.734249 IP ubuntu.17664 > ubuntu.82: Flags [.], seq 0:60, ack 1, win 35842, options [eol], length 60
04:01:20.763548 IP ubuntu.ssh > _gateway.51413: Flags [P.], seq 25745:25789, ack 3720, win 3551, options [nop,nop,TS val 764609992 ecr 317494131], length 44
04:01:20.763802 IP _gateway.51413 > ubuntu.ssh: Flags [.], ack 25789, win 2048, options [nop,nop,TS val 317494169 ecr 764609992], length 0
04:01:20.794328 IP ubuntu.17664 > ubuntu.82: Flags [.], seq 0:60, ack 1, win 35842, options [eol], length 60
04:01:20.832583 IP ubuntu.ssh > _gateway.51413: Flags [P.], seq 25789:25833, ack 3720, win 3551, options [nop,nop,TS val 764610061 ecr 317494169], length 44
04:01:20.832961 IP _gateway.51413 > ubuntu.ssh: Flags [.], ack 25833, win 2048, options [nop,nop,TS val 317494237 ecr 764610061], length 0
04:01:20.862488 IP ubuntu.17664 > ubuntu.82: Flags [.], seq 0:60, ack 1, win 35842, options [eol], length 60
04:01:20.888852 IP ubuntu.ssh > _gateway.51413: Flags [P.], seq 25833:25885, ack 3720, win 3551, options [nop,nop,TS val 764610117 ecr 317494237], length 52
04:01:20.889364 IP _gateway.51413 > ubuntu.ssh: Flags [.], ack 25885, win 2048, options [nop,nop,TS val 317494293 ecr 764610117], length 0
04:01:20.891460 IP _gateway.51413 > ubuntu.ssh: Flags [P.], seq 3720:3780, ack 25885, win 2048, options [nop,nop,TS val 317494295 ecr 764610117], length 60
04:01:20.893571 IP ubuntu.ssh > _gateway.51413: Flags [P.], seq 25885:25945, ack 3780, win 3551, options [nop,nop,TS val 764610122 ecr 317494295], length 60
04:01:20.893905 IP _gateway.51413 > ubuntu.ssh: Flags [.], ack 25945, win 2047, options [nop,nop,TS val 317494297 ecr 764610122], length 0
04:01:20.895270 IP ubuntu.ssh > _gateway.51413: Flags [P.], seq 25945:25989, ack 3780, win 3551, options [nop,nop,TS val 764610123 ecr 317494297], length 44
04:01:20.895482 IP _gateway.51413 > ubuntu.ssh: Flags [.], ack 25989, win 2047, options [nop,nop,TS val 317494298 ecr 764610123], length 0
04:01:20.926399 IP ubuntu.17664 > ubuntu.82: Flags [.], seq 0:60, ack 1, win 35842, options [eol], length 60
04:01:20.960291 IP ubuntu.ssh > _gateway.51413: Flags [P.], seq 25989:26033, ack 3780, win 3551, options [nop,nop,TS val 764610189 ecr 317494298], length 44
04:01:20.960610 IP _gateway.51413 > ubuntu.ssh: Flags [.], ack 26033, win 2048, options [nop,nop,TS val 317494362 ecr 764610189], length 0
04:01:20.991592 IP ubuntu.17664 > ubuntu.82: Flags [.], seq 0:60, ack 1, win 35842, options [eol], length 60
04:01:21.023815 IP ubuntu.ssh > _gateway.51413: Flags [P.], seq 26033:26077, ack 3780, win 3551, options [nop,nop,TS val 764610252 ecr 317494362], length 44
04:01:21.024119 IP _gateway.51413 > ubuntu.ssh: Flags [.], ack 26077, win 2048, options [nop,nop,TS val 317494425 ecr 764610252], length 0
04:01:21.026483 IP _gateway.51413 > ubuntu.ssh: Flags [P.], seq 3780:3848, ack 26077, win 2048, options [nop,nop,TS val 317494427 ecr 764610252], length 68
04:01:21.028530 IP ubuntu.ssh > _gateway.51413: Flags [P.], seq 26077:26145, ack 3848, win 3551, options [nop,nop,TS val 764610257 ecr 317494427], length 68
04:01:21.028850 IP _gateway.51413 > ubuntu.ssh: Flags [.], ack 26145, win 2046, options [nop,nop,TS val 317494429 ecr 764610257], length 0
04:01:21.047373 IP _gateway.51413 > ubuntu.ssh: Flags [P.], seq 3848:3908, ack 26145, win 2048, options [nop,nop,TS val 317494447 ecr 764610257], length 60
04:01:21.047440 IP _gateway.51413 > ubuntu.ssh: Flags [P.], seq 3908:3984, ack 26145, win 2048, options [nop,nop,TS val 317494447 ecr 764610257], length 76
04:01:21.047583 IP ubuntu.ssh > _gateway.51413: Flags [.], ack 3984, win 3551, options [nop,nop,TS val 764610276 ecr 317494447], length 0
04:01:21.049148 IP ubuntu.ssh > _gateway.51413: Flags [P.], seq 26145:26205, ack 3984, win 3551, options [nop,nop,TS val 764610277 ecr 317494447], length 60
04:01:21.049439 IP _gateway.51413 > ubuntu.ssh: Flags [.], ack 26205, win 2048, options [nop,nop,TS val 317494449 ecr 764610277], length 0
04:01:21.051962 IP ubuntu.ssh > _gateway.51413: Flags [P.], seq 26205:26273, ack 3984, win 3551, options [nop,nop,TS val 764610280 ecr 317494449], length 68
04:01:21.052361 IP _gateway.51413 > ubuntu.ssh: Flags [.], ack 26273, win 2048, options [nop,nop,TS val 317494451 ecr 764610280], length 0
04:01:21.053560 IP _gateway.51413 > ubuntu.ssh: Flags [P.], seq 3984:4044, ack 26273, win 2048, options [nop,nop,TS val 317494452 ecr 764610280], length 60
04:01:21.055899 IP ubuntu.ssh > _gateway.51413: Flags [P.], seq 26273:26333, ack 4044, win 3551, options [nop,nop,TS val 764610284 ecr 317494452], length 60
04:01:21.057137 IP _gateway.51413 > ubuntu.ssh: Flags [.], ack 26333, win 2047, options [nop,nop,TS val 317494455 ecr 764610284], length 0
04:01:21.058083 IP ubuntu.17664 > ubuntu.82: Flags [.], seq 0:60, ack 1, win 35842, options [eol], length 60
04:01:21.059110 IP _gateway.51413 > ubuntu.ssh: Flags [P.], seq 4044:4104, ack 26333, win 2048, options [nop,nop,TS val 317494456 ecr 764610284], length 60
04:01:21.060836 IP ubuntu.ssh > _gateway.51413: Flags [P.], seq 26333:26385, ack 4104, win 3551, options [nop,nop,TS val 764610289 ecr 317494456], length 52
04:01:21.061103 IP _gateway.51413 > ubuntu.ssh: Flags [.], ack 26385, win 2047, options [nop,nop,TS val 317494458 ecr 764610289], length 0
04:01:21.065699 IP _gateway.51413 > ubuntu.ssh: Flags [P.], seq 4104:4164, ack 26385, win 2048, options [nop,nop,TS val 317494462 ecr 764610289], length 60
04:01:21.067916 IP ubuntu.ssh > _gateway.51413: Flags [P.], seq 26385:26445, ack 4164, win 3551, options [nop,nop,TS val 764610296 ecr 317494462], length 60
04:01:21.068158 IP _gateway.51413 > ubuntu.ssh: Flags [.], ack 26445, win 2047, options [nop,nop,TS val 317494464 ecr 764610296], length 0
04:01:21.110789 IP ubuntu.ssh > _gateway.51413: Flags [P.], seq 26445:26497, ack 4164, win 3551, options [nop,nop,TS val 764610339 ecr 317494464], length 52
04:01:21.111238 IP _gateway.51413 > ubuntu.ssh: Flags [.], ack 26497, win 2047, options [nop,nop,TS val 317494506 ecr 764610339], length 0
04:01:21.130298 IP ubuntu.17664 > ubuntu.82: Flags [.], seq 0:60, ack 1, win 35842, options [eol], length 60
04:01:21.163853 IP ubuntu.ssh > _gateway.51413: Flags [P.], seq 26497:26541, ack 4164, win 3551, options [nop,nop,TS val 764610392 ecr 317494506], length 44
04:01:21.164163 IP _gateway.51413 > ubuntu.ssh: Flags [.], ack 26541, win 2047, options [nop,nop,TS val 317494557 ecr 764610392], length 0
04:01:21.194563 IP ubuntu.17664 > ubuntu.82: Flags [.], seq 0:60, ack 1, win 35842, options [eol], length 60
04:01:21.214497 IP _gateway.51413 > ubuntu.ssh: Flags [P.], seq 4164:4272, ack 26541, win 2048, options [nop,nop,TS val 317494607 ecr 764610392], length 108
04:01:21.218174 IP ubuntu.ssh > _gateway.51413: Flags [P.], seq 26541:26593, ack 4272, win 3551, options [nop,nop,TS val 764610446 ecr 317494607], length 52
04:01:21.218354 IP _gateway.51413 > ubuntu.ssh: Flags [.], ack 26593, win 2047, options [nop,nop,TS val 317494611 ecr 764610446], length 0
04:01:21.222455 IP ubuntu.ssh > _gateway.51413: Flags [P.], seq 26593:26741, ack 4272, win 3551, options [nop,nop,TS val 764610451 ecr 317494611], length 148
04:01:21.222685 IP _gateway.51413 > ubuntu.ssh: Flags [.], ack 26741, win 2048, options [nop,nop,TS val 317494615 ecr 764610451], length 0
04:01:21.227183 IP ubuntu.ssh > _gateway.51413: Flags [P.], seq 26741:26785, ack 4272, win 3551, options [nop,nop,TS val 764610455 ecr 317494615], length 44
04:01:21.227400 IP _gateway.51413 > ubuntu.ssh: Flags [.], ack 26785, win 2048, options [nop,nop,TS val 317494619 ecr 764610455], length 0
04:01:21.236157 IP ubuntu.ssh > _gateway.51413: Flags [P.], seq 26785:26837, ack 4272, win 3551, options [nop,nop,TS val 764610464 ecr 317494619], length 52
04:01:21.236487 IP _gateway.51413 > ubuntu.ssh: Flags [.], ack 26837, win 2048, options [nop,nop,TS val 317494627 ecr 764610464], length 0
04:01:21.266595 IP ubuntu.17664 > ubuntu.82: Flags [.], seq 0:60, ack 1, win 35842, options [eol], length 60
04:01:21.299825 IP ubuntu.ssh > _gateway.51413: Flags [P.], seq 26837:26881, ack 4272, win 3551, options [nop,nop,TS val 764610528 ecr 317494627], length 44
04:01:21.300144 IP _gateway.51413 > ubuntu.ssh: Flags [.], ack 26881, win 2048, options [nop,nop,TS val 317494690 ecr 764610528], length 0
04:01:21.330146 IP ubuntu.17664 > ubuntu.82: Flags [.], seq 0:60, ack 1, win 35842, options [eol], length 60
04:01:21.363749 IP ubuntu.ssh > _gateway.51413: Flags [P.], seq 26881:26925, ack 4272, win 3551, options [nop,nop,TS val 764610592 ecr 317494690], length 44
04:01:21.364093 IP _gateway.51413 > ubuntu.ssh: Flags [.], ack 26925, win 2048, options [nop,nop,TS val 317494753 ecr 764610592], length 0
04:01:21.394175 IP ubuntu.17664 > ubuntu.82: Flags [.], seq 0:60, ack 1, win 35842, options [eol], length 60
04:01:21.435211 IP ubuntu.ssh > _gateway.51413: Flags [P.], seq 26925:26969, ack 4272, win 3551, options [nop,nop,TS val 764610663 ecr 317494753], length 44
04:01:21.435503 IP _gateway.51413 > ubuntu.ssh: Flags [.], ack 26969, win 2048, options [nop,nop,TS val 317494824 ecr 764610663], length 0
04:01:21.478093 IP ubuntu.17664 > ubuntu.82: Flags [.], seq 0:60, ack 1, win 35842, options [eol], length 60
04:01:21.512336 IP ubuntu.ssh > _gateway.51413: Flags [P.], seq 26969:27013, ack 4272, win 3551, options [nop,nop,TS val 764610741 ecr 317494824], length 44
04:01:21.512754 IP _gateway.51413 > ubuntu.ssh: Flags [.], ack 27013, win 2048, options [nop,nop,TS val 317494901 ecr 764610741], length 0
04:01:21.525805 IP _gateway.51413 > ubuntu.ssh: Flags [P.], seq 4272:4332, ack 27013, win 2048, options [nop,nop,TS val 317494913 ecr 764610741], length 60
04:01:21.528121 IP ubuntu.ssh > _gateway.51413: Flags [P.], seq 27013:27065, ack 4332, win 3551, options [nop,nop,TS val 764610756 ecr 317494913], length 52
04:01:21.528400 IP _gateway.51413 > ubuntu.ssh: Flags [.], ack 27065, win 2047, options [nop,nop,TS val 317494915 ecr 764610756], length 0
04:01:21.542476 IP ubuntu.17664 > ubuntu.82: Flags [.], seq 0:60, ack 1, win 35842, options [eol], length 60
04:01:21.576770 IP ubuntu.ssh > _gateway.51413: Flags [P.], seq 27065:27117, ack 4332, win 3551, options [nop,nop,TS val 764610805 ecr 317494915], length 52
04:01:21.577216 IP _gateway.51413 > ubuntu.ssh: Flags [.], ack 27117, win 2048, options [nop,nop,TS val 317494962 ecr 764610805], length 0
04:01:21.612970 IP _gateway.51413 > ubuntu.ssh: Flags [P.], seq 4332:4400, ack 27117, win 2048, options [nop,nop,TS val 317494997 ecr 764610805], length 68
04:01:21.614238 IP ubuntu.17664 > ubuntu.82: Flags [.], seq 0:60, ack 1, win 35842, options [eol], length 60
04:01:21.616449 IP ubuntu.ssh > _gateway.51413: Flags [P.], seq 27117:27169, ack 4400, win 3551, options [nop,nop,TS val 764610845 ecr 317494997], length 52
04:01:21.616665 IP _gateway.51413 > ubuntu.ssh: Flags [.], ack 27169, win 2047, options [nop,nop,TS val 317495000 ecr 764610845], length 0
04:01:21.621708 IP ubuntu.ssh > _gateway.51413: Flags [P.], seq 27169:27229, ack 4400, win 3551, options [nop,nop,TS val 764610850 ecr 317495000], length 60
04:01:21.621993 IP _gateway.51413 > ubuntu.ssh: Flags [.], ack 27229, win 2048, options [nop,nop,TS val 317495005 ecr 764610850], length 0
04:01:21.649066 IP ubuntu.ssh > _gateway.51413: Flags [P.], seq 27229:27273, ack 4400, win 3551, options [nop,nop,TS val 764610877 ecr 317495005], length 44
04:01:21.649547 IP _gateway.51413 > ubuntu.ssh: Flags [.], ack 27273, win 2048, options [nop,nop,TS val 317495032 ecr 764610877], length 0
04:01:21.678050 IP ubuntu.17664 > ubuntu.82: Flags [.], seq 0:60, ack 1, win 35842, options [eol], length 60
04:01:21.711232 IP ubuntu.ssh > _gateway.51413: Flags [P.], seq 27273:27317, ack 4400, win 3551, options [nop,nop,TS val 764610939 ecr 317495032], length 44
04:01:21.711527 IP _gateway.51413 > ubuntu.ssh: Flags [.], ack 27317, win 2048, options [nop,nop,TS val 317495094 ecr 764610939], length 0
04:01:21.742047 IP ubuntu.17664 > ubuntu.82: Flags [.], seq 0:60, ack 1, win 35842, options [eol], length 60
04:01:21.777325 IP ubuntu.ssh > _gateway.51413: Flags [P.], seq 27317:27361, ack 4400, win 3551, options [nop,nop,TS val 764611006 ecr 317495094], length 44
04:01:21.777735 IP _gateway.51413 > ubuntu.ssh: Flags [.], ack 27361, win 2048, options [nop,nop,TS val 317495159 ecr 764611006], length 0
04:01:21.806322 IP ubuntu.17664 > ubuntu.82: Flags [.], seq 0:60, ack 1, win 35842, options [eol], length 60
04:01:21.847346 IP ubuntu.ssh > _gateway.51413: Flags [P.], seq 27361:27405, ack 4400, win 3551, options [nop,nop,TS val 764611076 ecr 317495159], length 44
04:01:21.847668 IP _gateway.51413 > ubuntu.ssh: Flags [.], ack 27405, win 2048, options [nop,nop,TS val 317495229 ecr 764611076], length 0
04:01:21.848982 IP _gateway.51413 > ubuntu.ssh: Flags [P.], seq 4400:4460, ack 27405, win 2048, options [nop,nop,TS val 317495229 ecr 764611076], length 60
04:01:21.851040 IP ubuntu.ssh > _gateway.51413: Flags [P.], seq 27405:27465, ack 4460, win 3551, options [nop,nop,TS val 764611079 ecr 317495229], length 60
04:01:21.851241 IP _gateway.51413 > ubuntu.ssh: Flags [.], ack 27465, win 2047, options [nop,nop,TS val 317495232 ecr 764611079], length 0
04:01:21.878156 IP ubuntu.17664 > ubuntu.82: Flags [.], seq 0:60, ack 1, win 35842, options [eol], length 60
04:01:21.907312 IP ubuntu.ssh > _gateway.51413: Flags [P.], seq 27465:27517, ack 4460, win 3551, options [nop,nop,TS val 764611136 ecr 317495232], length 52
04:01:21.908577 IP _gateway.51413 > ubuntu.ssh: Flags [.], ack 27517, win 2047, options [nop,nop,TS val 317495289 ecr 764611136], length 0
04:01:21.910322 IP _gateway.51413 > ubuntu.ssh: Flags [P.], seq 4460:4520, ack 27517, win 2048, options [nop,nop,TS val 317495290 ecr 764611136], length 60
04:01:21.911868 IP ubuntu.ssh > _gateway.51413: Flags [P.], seq 27517:27561, ack 4520, win 3551, options [nop,nop,TS val 764611140 ecr 317495290], length 44
04:01:21.912142 IP _gateway.51413 > ubuntu.ssh: Flags [.], ack 27561, win 2047, options [nop,nop,TS val 317495291 ecr 764611140], length 0
04:01:21.912580 IP ubuntu.ssh > _gateway.51413: Flags [P.], seq 27561:27621, ack 4520, win 3551, options [nop,nop,TS val 764611141 ecr 317495291], length 60
04:01:21.913293 IP _gateway.51413 > ubuntu.ssh: Flags [.], ack 27621, win 2048, options [nop,nop,TS val 317495291 ecr 764611141], length 0
04:01:21.942650 IP ubuntu.17664 > ubuntu.82: Flags [.], seq 0:60, ack 1, win 35842, options [eol], length 60
04:01:21.975518 IP ubuntu.ssh > _gateway.51413: Flags [P.], seq 27621:27665, ack 4520, win 3551, options [nop,nop,TS val 764611204 ecr 317495291], length 44
04:01:21.975855 IP _gateway.51413 > ubuntu.ssh: Flags [.], ack 27665, win 2048, options [nop,nop,TS val 317495354 ecr 764611204], length 0
04:01:22.006138 IP ubuntu.17664 > ubuntu.82: Flags [.], seq 0:60, ack 1, win 35842, options [eol], length 60
04:01:22.039700 IP ubuntu.ssh > _gateway.51413: Flags [P.], seq 27665:27709, ack 4520, win 3551, options [nop,nop,TS val 764611268 ecr 317495354], length 44
04:01:22.040052 IP _gateway.51413 > ubuntu.ssh: Flags [.], ack 27709, win 2048, options [nop,nop,TS val 317495418 ecr 764611268], length 0
04:01:22.070536 IP ubuntu.17664 > ubuntu.82: Flags [.], seq 0:60, ack 1, win 35842, options [eol], length 60
04:01:22.103456 IP ubuntu.ssh > _gateway.51413: Flags [P.], seq 27709:27753, ack 4520, win 3551, options [nop,nop,TS val 764611332 ecr 317495418], length 44
04:01:22.103740 IP _gateway.51413 > ubuntu.ssh: Flags [.], ack 27753, win 2048, options [nop,nop,TS val 317495481 ecr 764611332], length 0
04:01:22.134120 IP ubuntu.17664 > ubuntu.82: Flags [.], seq 0:60, ack 1, win 35842, options [eol], length 60
04:01:22.179182 IP ubuntu.ssh > _gateway.51413: Flags [P.], seq 27753:27797, ack 4520, win 3551, options [nop,nop,TS val 764611407 ecr 317495481], length 44
04:01:22.179485 IP _gateway.51413 > ubuntu.ssh: Flags [.], ack 27797, win 2048, options [nop,nop,TS val 317495556 ecr 764611407], length 0
04:01:22.210023 IP ubuntu.17664 > ubuntu.82: Flags [.], seq 0:60, ack 1, win 35842, options [eol], length 60
04:01:22.243443 IP ubuntu.ssh > _gateway.51413: Flags [P.], seq 27797:27841, ack 4520, win 3551, options [nop,nop,TS val 764611472 ecr 317495556], length 44
04:01:22.243734 IP _gateway.51413 > ubuntu.ssh: Flags [.], ack 27841, win 2048, options [nop,nop,TS val 317495620 ecr 764611472], length 0
04:01:22.273998 IP ubuntu.17664 > ubuntu.82: Flags [.], seq 0:60, ack 1, win 35842, options [eol], length 60
04:01:22.306858 IP ubuntu.ssh > _gateway.51413: Flags [P.], seq 27841:27885, ack 4520, win 3551, options [nop,nop,TS val 764611535 ecr 317495620], length 44
04:01:22.307122 IP _gateway.51413 > ubuntu.ssh: Flags [.], ack 27885, win 2048, options [nop,nop,TS val 317495682 ecr 764611535], length 0
04:01:22.337937 IP ubuntu.17664 > ubuntu.82: Flags [.], seq 0:60, ack 1, win 35842, options [eol], length 60
04:01:22.372182 IP ubuntu.ssh > _gateway.51413: Flags [P.], seq 27885:27929, ack 4520, win 3551, options [nop,nop,TS val 764611600 ecr 317495682], length 44
04:01:22.372487 IP _gateway.51413 > ubuntu.ssh: Flags [.], ack 27929, win 2048, options [nop,nop,TS val 317495747 ecr 764611600], length 0
04:01:22.394743 IP ubuntu.17664 > ubuntu.82: Flags [.], seq 0:60, ack 1, win 35842, options [eol], length 60
04:01:22.427722 IP ubuntu.ssh > _gateway.51413: Flags [P.], seq 27929:27973, ack 4520, win 3551, options [nop,nop,TS val 764611656 ecr 317495747], length 44
04:01:22.428188 IP _gateway.51413 > ubuntu.ssh: Flags [.], ack 27973, win 2048, options [nop,nop,TS val 317495802 ecr 764611656], length 0
04:01:22.458126 IP ubuntu.17664 > ubuntu.82: Flags [.], seq 0:60, ack 1, win 35842, options [eol], length 60
04:01:22.492425 IP ubuntu.ssh > _gateway.51413: Flags [P.], seq 27973:28017, ack 4520, win 3551, options [nop,nop,TS val 764611721 ecr 317495802], length 44
04:01:22.492920 IP _gateway.51413 > ubuntu.ssh: Flags [.], ack 28017, win 2048, options [nop,nop,TS val 317495866 ecr 764611721], length 0
04:01:22.522615 IP ubuntu.17664 > ubuntu.82: Flags [.], seq 0:60, ack 1, win 35842, options [eol], length 60
04:01:22.555425 IP ubuntu.ssh > _gateway.51413: Flags [P.], seq 28017:28061, ack 4520, win 3551, options [nop,nop,TS val 764611784 ecr 317495866], length 44
04:01:22.555783 IP _gateway.51413 > ubuntu.ssh: Flags [.], ack 28061, win 2048, options [nop,nop,TS val 317495929 ecr 764611784], length 0
04:01:22.586733 IP ubuntu.17664 > ubuntu.82: Flags [.], seq 0:60, ack 1, win 35842, options [eol], length 60
04:01:22.619627 IP ubuntu.ssh > _gateway.51413: Flags [P.], seq 28061:28105, ack 4520, win 3551, options [nop,nop,TS val 764611848 ecr 317495929], length 44
04:01:22.620019 IP _gateway.51413 > ubuntu.ssh: Flags [.], ack 28105, win 2048, options [nop,nop,TS val 317495992 ecr 764611848], length 0
04:01:22.650317 IP ubuntu.17664 > ubuntu.82: Flags [.], seq 0:60, ack 1, win 35842, options [eol], length 60
04:01:22.684792 IP ubuntu.ssh > _gateway.51413: Flags [P.], seq 28105:28149, ack 4520, win 3551, options [nop,nop,TS val 764611913 ecr 317495992], length 44
04:01:22.685199 IP _gateway.51413 > ubuntu.ssh: Flags [.], ack 28149, win 2048, options [nop,nop,TS val 317496057 ecr 764611913], length 0
04:01:22.714087 IP ubuntu.17664 > ubuntu.82: Flags [.], seq 0:60, ack 1, win 35842, options [eol], length 60
04:01:22.747481 IP ubuntu.ssh > _gateway.51413: Flags [P.], seq 28149:28193, ack 4520, win 3551, options [nop,nop,TS val 764611976 ecr 317496057], length 44
04:01:22.747722 IP _gateway.51413 > ubuntu.ssh: Flags [.], ack 28193, win 2048, options [nop,nop,TS val 317496119 ecr 764611976], length 0
04:01:22.774517 IP ubuntu.17664 > ubuntu.82: Flags [.], seq 0:60, ack 1, win 35842, options [eol], length 60
04:01:22.808086 IP ubuntu.ssh > _gateway.51413: Flags [P.], seq 28193:28237, ack 4520, win 3551, options [nop,nop,TS val 764612036 ecr 317496119], length 44
04:01:22.808471 IP _gateway.51413 > ubuntu.ssh: Flags [.], ack 28237, win 2048, options [nop,nop,TS val 317496179 ecr 764612036], length 0
04:01:22.842592 IP ubuntu.17664 > ubuntu.82: Flags [.], seq 0:60, ack 1, win 35842, options [eol], length 60
04:01:22.876960 IP ubuntu.ssh > _gateway.51413: Flags [P.], seq 28237:28281, ack 4520, win 3551, options [nop,nop,TS val 764612105 ecr 317496179], length 44
04:01:22.877430 IP _gateway.51413 > ubuntu.ssh: Flags [.], ack 28281, win 2048, options [nop,nop,TS val 317496247 ecr 764612105], length 0

